item_type,brand,name,price,socket,form_factor,max_memory,memory_slots,color
mobo,MSI, B650 GAMING PLUS WIFI,736.57,AM5,ATX,192,4,Black
mobo,Asus, ROG STRIX B650-A GAMING WIFI,866.56,AM5,ATX,192,4,Black / Silver
mobo,MSI, B760 GAMING PLUS WIFI,693.24,LGA1700,ATX,192,4,Black / Silver
mobo,MSI, PRO Z790-A MAX WIFI,1039.88,LGA1700,ATX,192,4,Silver / Black
mobo,MSI, B550 GAMING GEN3,433.26,AM4,ATX,128,4,Black
mobo,MSI, B450M-A PRO MAX II,303.22,AM4,Micro ATX,64,2,Black
mobo,MSI, MAG B650 TOMAHAWK WIFI,866.56,AM5,ATX,192,4,Black
mobo,Gigabyte, B650 GAMING X AX,779.9,AM5,ATX,192,4,Black / Gray
mobo,Asus, PRIME B550M-A WIFI II,454.92,AM4,Micro ATX,128,4,Blue / Silver
mobo,ASRock, B650M Pro RS WiFi,649.91,AM5,Micro ATX,192,4,Black / Silver
mobo,ASRock, B660M Pro RS,411.59,LGA1700,Micro ATX,128,4,Gray / Black
mobo,MSI, PRO B650M-P,519.92,AM5,Micro ATX,192,4,Black / Silver
mobo,Asus, TUF GAMING Z790-PRO WIFI,1213.2,LGA1700,ATX,192,4,Black
mobo,MSI, MAG X670E TOMAHAWK WIFI,1126.54,AM5,ATX,192,4,Black
mobo,MSI, PRO Z790-P WIFI,866.56,LGA1700,ATX,192,4,Black / Silver
mobo,MSI, MAG B550 TOMAHAWK MAX WIFI,693.24,AM4,ATX,128,4,Silver / Black
mobo,Asus, ROG STRIX B550-F GAMING WIFI II,823.23,AM4,ATX,128,4,Black / Red
mobo,MSI, PRO B650M-A WIFI,680.24,AM5,Micro ATX,192,4,Black
mobo,ASRock, B650I Lightning Wifi,866.56,AM5,Mini ITX,96,2,Black
mobo,MSI, B550M PRO-VDH WIFI,433.26,AM4,Micro ATX,128,4,Black
mobo,MSI, PRO B650-S WIFI,606.58,AM5,ATX,192,4,Black
mobo,Gigabyte, B650 EAGLE AX,736.57,AM5,ATX,192,4,Gray / Black
mobo,Asus, ROG STRIX B650E-F GAMING WIFI,1126.54,AM5,ATX,192,4,Black
mobo,Gigabyte, B650 AORUS ELITE AX ICE,996.55,AM5,ATX,192,4,Silver
mobo,Asus, ROG MAXIMUS Z790 DARK HERO,2513.1,LGA1700,ATX,192,4,Black
mobo,Asus, Prime B450M-A II,303.22,AM4,Micro ATX,128,4,
mobo,Gigabyte, B650 AORUS ELITE AX,866.56,AM5,ATX,192,4,Black / Silver
mobo,Asus, PRIME B760-PLUS,563.25,LGA1700,ATX,192,4,Black / Silver
mobo,Gigabyte, B550M K,411.59,AM4,Micro ATX,128,4,Brown / Silver
mobo,MSI, MAG Z790 TOMAHAWK WIFI,909.89,LGA1700,ATX,192,4,Black
mobo,Gigabyte, TRX40 AORUS XTREME,7972.81,sTRX4,XL ATX,256,8,Black / Silver
mobo,Gigabyte, X670E AORUS PRO X,1299.86,AM5,ATX,192,4,White / Silver
mobo,Asus, ROG STRIX Z790-A GAMING WIFI II,1455.84,LGA1700,ATX,192,4,Black / Silver
mobo,Gigabyte, Z790 AORUS ELITE AX,953.22,LGA1700,ATX,192,4,Black
mobo,ASRock, B450M-HDV R4.0,259.94,AM4,Micro ATX,32,2,Black / White
mobo,MSI, PRO B550M-VC WIFI,505.01,AM4,Micro ATX,128,4,Black
mobo,MSI, PRO B760-P WIFI DDR4,606.58,LGA1700,ATX,128,4,Black
mobo,Asus, TUF GAMING B650-PLUS WIFI,866.56,AM5,ATX,128,4,Black
mobo,Gigabyte, B550 UD AC,433.26,AM4,ATX,128,4,Brown / Black
mobo,Asus, ROG STRIX B650E-I GAMING WIFI,1299.86,AM5,Mini ITX,96,2,Black
mobo,Asus, ROG STRIX Z790-E GAMING WIFI II,1854.48,LGA1700,ATX,192,4,Black
mobo,MSI, B550-A PRO,476.59,AM4,ATX,128,4,Black / Silver
mobo,MSI, PRO A620M-E,324.76,AM5,Micro ATX,96,2,Black
mobo,MSI, PRO H610M-G DDR4,346.6,LGA1700,Micro ATX,64,2,Black / Silver
mobo,ASRock, B650M Pro RS,584.91,AM5,Micro ATX,192,4,Black / Silver
mobo,MSI, PRO Z690-A WIFI,649.91,LGA1700,ATX,192,4,Black / Silver
mobo,Asus, ROG STRIX B760-I GAMING WIFI,866.56,LGA1700,Mini ITX,96,2,Black
mobo,ASRock, B550M Pro4,433.26,AM4,Micro ATX,128,4,Silver / Black
mobo,Gigabyte, A520I AC,476.59,AM4,Mini ITX,64,2,Black
mobo,ASRock, B450M/ac R2.0,336.5,AM4,Micro ATX,128,4,Black / Silver
mobo,MSI, B450M PRO-VDH MAX,324.93,AM4,Micro ATX,64,4,Black / Silver
mobo,ASRock, B760M-HDV/M.2,519.92,LGA1700,Micro ATX,96,2,White / Black
mobo,Gigabyte, B760M DS3H DDR4,433.26,LGA1700,Micro ATX,128,4,Black
mobo,Asus, TUF GAMING B550-PLUS WIFI II,580.62,AM4,ATX,128,4,Black / Gray
mobo,Gigabyte, B650M D3HP,519.92,AM5,Micro ATX,192,4,Black
mobo,MSI, PRO B650-P WIFI,706.24,AM5,ATX,192,4,Black
mobo,Asus, ROG STRIX B550-A GAMING,745.23,AM4,ATX,128,4,Black / White
mobo,Asus, TUF GAMING A520M-PLUS WIFI,424.59,AM4,Micro ATX,128,4,Black / Orange
mobo,Gigabyte, B650 GAMING X AX V2,801.56,AM5,ATX,192,4,Gray / Black
mobo,Asus, ROG STRIX X670E-E GAMING WIFI,1949.81,AM5,ATX,192,4,Black / Silver
mobo,Asus, ROG MAXIMUS Z790 FORMULA,3249.71,LGA1700,ATX,192,4,Silver / Black
mobo,NZXT, N7 B650E,1213.2,AM5,ATX,128,4,White
mobo,ASRock, Z690M-ITX/ax,584.91,LGA1700,Mini ITX,64,2,Silver / Black
mobo,Gigabyte, B550M AORUS ELITE AX,433.26,AM4,Micro ATX,128,4,Black / Silver
mobo,MSI, MPG B550 GAMING PLUS,567.62,AM4,ATX,128,4,Black
mobo,Gigabyte, B550 AORUS ELITE AX V2,606.58,AM4,ATX,128,4,Black / Silver
mobo,ASRock, A620I LIGHTNING WIFI,606.58,AM5,Mini ITX,96,2,Black
mobo,Gigabyte, B650M AORUS ELITE AX,823.23,AM5,Micro ATX,192,4,Black
mobo,Gigabyte, B450M DS3H WIFI,385.55,AM4,Micro ATX,128,4,Brown / Black
mobo,Asus, TUF GAMING X570-PLUS (WI-FI),840.56,AM4,ATX,128,4,Black / Gold
mobo,ASRock, B760M-H/M.2,389.93,LGA1700,Micro ATX,96,2,Silver / Black
mobo,Asus, TUF GAMING X670E-PLUS WIFI,1169.87,AM5,ATX,192,4,Black / Orange
mobo,ASRock, B650M-HDV/M.2,653.03,AM5,Micro ATX,96,2,Silver / Black
mobo,MSI, MPG B650I EDGE WIFI,1132.34,AM5,Mini ITX,96,2,Black / Silver
mobo,Gigabyte, B650I AORUS ULTRA,1126.54,AM5,Mini ITX,96,2,Black / Silver
mobo,Gigabyte, B550 GAMING X V2,402.93,AM4,ATX,128,4,Black
mobo,MSI, X670E GAMING PLUS WIFI,996.55,AM5,ATX,192,4,Silver / Black
mobo,ASRock, B650M-H/M.2+,433.26,AM5,Micro ATX,96,2,Silver / Black
mobo,Asus, ROG STRIX Z690-I GAMING WIFI,823.23,LGA1700,Mini ITX,96,2,Black / Silver
mobo,Gigabyte, B450M K,346.64,AM4,Micro ATX,64,2,Brown / Silver
mobo,Gigabyte, Z790 AORUS PRO X,1516.51,LGA1700,ATX,192,4,Silver
mobo,MSI, MAG B550 TOMAHAWK,606.58,AM4,ATX,128,4,Black / Silver
mobo,MSI, MEG Z790 GODLIKE MAX,5186.56,LGA1700,EATX,192,4,Black
mobo,Gigabyte, B650 AORUS ELITE AX V2,813.69,AM5,ATX,192,4,Black / Silver
mobo,ASRock, A520M-HDV,290.22,AM4,Micro ATX,64,2,Black / Silver
mobo,MSI, B450 Gaming Plus MAX,324.89,AM4,ATX,128,4,Red / Black
mobo,ASRock, B550M-ITX/ac,563.25,AM4,Mini ITX,64,2,Silver / Black
mobo,ASRock, B650 Steel Legend WiFi,779.9,AM5,ATX,192,4,White / Silver
mobo,Gigabyte, A620I AX,606.58,AM5,Mini ITX,96,2,Black / Gray
mobo,Asus, ROG STRIX Z690-E GAMING WIFI,1000.88,LGA1700,ATX,192,4,Black
mobo,Asus, PRIME X670-P WIFI,909.89,AM5,ATX,192,4,Silver / Black
mobo,MSI, PRO B760M-P DDR4,433.26,LGA1700,Micro ATX,128,4,Black
mobo,Asus, ROG CROSSHAIR X670E HERO,2773.08,AM5,ATX,192,4,Black / Silver
mobo,Asus, ROG STRIX Z790-E GAMING WIFI,1559.84,LGA1700,ATX,192,4,Black
mobo,MSI, MAG B760 TOMAHAWK WIFI,779.9,LGA1700,ATX,192,4,Black
mobo,Gigabyte, H410M H V2,315.92,LGA1200,Micro ATX,64,2,Gray / Black
mobo,Asus, TUF GAMING Z790-PLUS WIFI,996.55,LGA1700,ATX,192,4,Black / Gray
mobo,ASRock, X670E Steel Legend,1126.54,AM5,ATX,192,4,Black / White
mobo,Gigabyte, B550I AORUS PRO AX,823.23,AM4,Mini ITX,64,2,Black / Silver
mobo,Gigabyte, B650M D3HP AX,584.91,AM5,Micro ATX,192,4,Black / Gray
mobo,Gigabyte, B760M DS3H AX,606.58,LGA1700,Micro ATX,192,4,Black
mobo,Gigabyte, B550M DS3H AC,472.25,AM4,Micro ATX,128,4,Black
mobo,Gigabyte, Z790 AORUS ELITE X WIFI7,1213.2,LGA1700,ATX,192,4,Black
mobo,Asus, PRIME Z790-P WIFI,823.23,LGA1700,ATX,192,4,Black / Silver
mobo,NZXT, N7 B650E,1083.21,AM5,ATX,128,4,Black
mobo,Asus, ProArt X670E-CREATOR WIFI,1841.48,AM5,ATX,192,4,Black / Copper
mobo,Gigabyte, X670 AORUS ELITE AX (rev. 1.0),1169.87,AM5,ATX,192,4,Black
mobo,ASRock, A620M Pro RS WiFi,770.62,AM5,Micro ATX,192,4,Silver / Black
mobo,ASRock, B450M PRO4 R2.0,347.29,AM4,Micro ATX,128,4,Gray / Black
mobo,MSI, PRO H610M-G WIFI DDR4,428.97,LGA1700,Micro ATX,64,2,Black / Silver
mobo,ASRock, H610M-HVS,303.22,LGA1700,Micro ATX,64,2,Gray / Black
mobo,MSI, MPG Z790 EDGE TI MAX WIFI,1299.86,LGA1700,ATX,192,4,Silver / Black
mobo,ASRock, B650E PG RIPTIDE WIFI,823.23,AM5,ATX,192,4,Black / Blue
mobo,ASRock, Z690 Extreme,563.25,LGA1700,ATX,128,4,Black / Silver
mobo,Gigabyte, Z790 EAGLE AX,797.01,LGA1700,ATX,192,4,Gray / Black
mobo,Gigabyte, B650E AORUS ELITE X AX ICE,1083.21,AM5,ATX,192,4,Silver / White
mobo,Gigabyte, B550M DS3H,385.64,AM4,Micro ATX,128,4,Black / Gold
mobo,Asus, ROG STRIX B650E-E GAMING WIFI,1434.83,AM5,ATX,192,4,Black
mobo,Gigabyte, B760 GAMING X AX,736.57,LGA1700,ATX,192,4,Black / Gray
mobo,Gigabyte, A520M K V2,338.15,AM4,Micro ATX,64,2,Brown / Black
mobo,Asus, ROG STRIX B550-F GAMING,688.9,AM4,ATX,128,4,Black
mobo,ASRock, B550 Phantom Gaming 4/ac,389.93,AM4,ATX,128,4,Silver / Black
mobo,MSI, PRO B760M-A WIFI DDR4,649.91,LGA1700,Micro ATX,128,4,Black
mobo,Asus, TUF GAMING B760M-PLUS WIFI II,844.89,LGA1700,Micro ATX,192,4,Black / Orange
mobo,Gigabyte, B760I AORUS PRO,866.56,LGA1700,Mini ITX,96,2,Silver / Black
mobo,ASRock, B650M PG RIPTIDE WIFI,736.57,AM5,Micro ATX,192,4,Black
mobo,Asus, TUF GAMING B650M-PLUS WIFI,823.23,AM5,Micro ATX,192,4,Black
mobo,Asus, ROG STRIX X670E-F GAMING WIFI,1516.51,AM5,ATX,192,4,Black / Silver
mobo,Asus, ProArt Z790-CREATOR WIFI,1906.48,LGA1700,ATX,192,4,Black / Copper
mobo,Asus, PRIME B650-PLUS,714.9,AM5,ATX,192,4,Black / Silver
mobo,MSI, A520M-A PRO,303.27,AM4,Micro ATX,64,2,Black
mobo,NZXT, N7 Z790,1286.86,LGA1700,ATX,192,4,Black
mobo,ASRock, B550M-HDV,324.89,AM4,Micro ATX,64,2,Black
mobo,ASRock, B550M PG RIPTIDE,446.21,AM4,Micro ATX,128,4,
mobo,Asus, ROG STRIX X670E-I GAMING WIFI,1841.48,AM5,Mini ITX,96,2,Black / Silver
mobo,Asus, ROG STRIX B760-A GAMING WIFI,909.89,LGA1700,ATX,192,4,Silver / Black
mobo,Gigabyte, X670 GAMING X AX V2,909.89,AM5,ATX,192,4,Black / Gray
mobo,Gigabyte, A520M DS3H V2,386.5,AM4,Micro ATX,128,4,Gray / Brown
mobo,Asus, ROG STRIX Z790-H GAMING WIFI,1083.21,LGA1700,ATX,192,4,Black
mobo,MSI, Z790 GAMING PLUS WIFI,866.56,LGA1700,ATX,192,4,Black
mobo,ASRock, Z690 Pro RS,519.92,LGA1700,ATX,128,4,Silver / Black
mobo,Asus, ROG STRIX Z790-F GAMING WIFI II,1776.49,LGA1700,ATX,192,4,Black
mobo,MSI, MEG X670E GODLIKE,5576.61,AM5,EATX,192,4,Black
mobo,Gigabyte, TRX40 AORUS PRO WIFI,2296.45,sTRX4,ATX,256,8,Black / Orange
mobo,Asus, TUF GAMING B550M-PLUS WIFI II,876.74,AM4,Micro ATX,128,4,Black / Gray
mobo,MSI, PRO Z790-S WIFI,736.57,LGA1700,ATX,192,4,Black
mobo,Asus, ROG STRIX X670E-A GAMING WIFI,1451.51,AM5,ATX,192,4,Silver / Black
mobo,ASRock, H370M-HDV,324.76,LGA1151,Micro ATX,64,2,Black / Silver
mobo,ASRock, B550 Phantom Gaming-ITX/ax,693.24,AM4,Mini ITX,64,2,Silver / Black
mobo,Asus, PRIME B660M-A WIFI D4,742.11,LGA1700,Micro ATX,128,4,Silver / Black
mobo,MSI, MAG B760M MORTAR WIFI II,779.9,LGA1700,Micro ATX,192,4,Silver / Black
mobo,Asus, ROG STRIX Z790-A GAMING WIFI D4,953.22,LGA1700,ATX,128,4,Black / Silver
mobo,MSI, MAG B650M MORTAR WIFI,866.38,AM5,Micro ATX,192,4,Black
mobo,MSI, MPG Z790I EDGE WIFI,1290.5,LGA1700,Mini ITX,96,2,Silver / Black
mobo,MSI, PRO B550-VC,606.58,AM4,ATX,128,4,Black
mobo,Gigabyte, Z790 AORUS ELITE AX ICE,1126.54,LGA1700,ATX,192,4,Silver / White
mobo,Asus, PRIME B550-PLUS,476.59,AM4,ATX,128,4,Black / White
mobo,ASRock, B760M Pro RS/D4 WiFi,645.57,LGA1700,Micro ATX,128,4,Silver / Black
mobo,ASRock, X670E PG Lightning,1034.55,AM5,ATX,192,4,Black
mobo,Gigabyte, A520M S2H,348.72,AM4,Micro ATX,64,2,Black
mobo,ASRock, B550 Phantom Gaming 4,389.93,AM4,ATX,128,4,Silver / Black
mobo,MSI, MAG Z790 TOMAHAWK MAX WIFI,1169.87,LGA1700,ATX,192,4,Black / Yellow
mobo,MSI, PRO-H610M-E-DDR4,394.78,LGA1700,Micro ATX,64,2,Black
mobo,Gigabyte, H510M K V2,367.14,LGA1200,Micro ATX,64,2,Black / Gray
mobo,Asus, PRIME Z790-A WIFI,1078.92,LGA1700,ATX,192,4,Black / Silver
mobo,Asus, PRIME A320M-K,298.89,AM4,Micro ATX,32,2,Black / White
mobo,MSI, MPG X670E CARBON WIFI,1776.49,AM5,ATX,192,4,Black
mobo,Intel, DQ45EK,1196.3,LGA775,Mini ITX,4,2,Green / Blue
mobo,Asus, ROG MAXIMUS Z790 HERO,2296.45,LGA1700,ATX,192,4,Black
mobo,ASRock, B450M Steel Legend,389.93,AM4,Micro ATX,64,4,Black / White
mobo,Gigabyte, Z790 AORUS ELITE X AX,996.55,LGA1700,ATX,192,4,Black
mobo,MSI, MPG B650 EDGE WIFI,987.88,AM5,ATX,192,4,Black / Silver
mobo,Asus, PRIME X670E-PRO WIFI,1298.86,AM5,ATX,192,4,Silver / Black
mobo,ASRock, B650 LiveMixer,602.24,AM5,ATX,192,4,Orange / Black
mobo,MSI, PRO Z790-P WIFI DDR4,871.76,LGA1700,ATX,128,4,Black / Silver
mobo,Asus, PRIME B650M-A WIFI II,981.68,AM5,Micro ATX,192,4,Black / Silver
mobo,Asus, PRIME B550-PLUS AC-HES,476.59,AM4,ATX,128,4,Silver / Black
mobo,MSI, PRO Z790-A WIFI,953.22,LGA1700,ATX,192,4,Black / Silver
mobo,Asus, PRIME H510M-A WIFI,476.59,LGA1200,Micro ATX,64,2,Black / Silver
mobo,ASRock, B760M PG SONIC WiFi,823.23,LGA1700,Micro ATX,192,4,Blue / Silver
mobo,Asus, TUF GAMING A620M-PLUS WIFI,645.57,AM5,Micro ATX,192,4,Black / Orange
mobo,ASRock, B650 PRO RS,1058.16,AM5,ATX,192,4,Black / Silver
mobo,Gigabyte, H610M S2H V2 DDR4,389.93,LGA1700,Micro ATX,64,2,Black / Gray
mobo,Asus, ROG STRIX Z790-I GAMING WIFI,1906.48,LGA1700,Mini ITX,96,2,Black
mobo,MSI, MAG B760 TOMAHAWK WIFI DDR4,779.9,LGA1700,ATX,128,4,Black
mobo,ASRock, Fatal1ty B450 Gaming-ITX/ac,636.34,AM4,Mini ITX,64,2,Black / Silver
mobo,Asus, ROG STRIX Z790-F GAMING WIFI,1169.87,LGA1700,ATX,192,4,Black
mobo,ASRock, Z790 Lightning WiFi,693.24,LGA1700,ATX,192,4,Silver / Black
mobo,Gigabyte, X670E AORUS XTREME (rev. 1.0),2816.41,AM5,EATX,192,4,Black
mobo,ASRock, B550M Steel Legend,502.54,AM4,Micro ATX,128,4,Silver / Black
mobo,Asus, PRIME Z790-V WIFI,953.22,LGA1700,ATX,192,4,Black / Silver
mobo,Gigabyte, Z790M AORUS ELITE AX ICE,888.22,LGA1700,Micro ATX,192,4,White / Silver
mobo,MSI, B450M-A PRO MAX,399.55,AM4,Micro ATX,32,2,Black
mobo,Gigabyte, Z790 UD AC,823.23,LGA1700,ATX,192,4,Black
mobo,Asus, ROG MAXIMUS Z790 APEX ENCORE,3767.41,LGA1700,ATX,96,2,Black
mobo,ASRock, B650 PG LIGHTNING,649.91,AM5,ATX,192,4,Black
mobo,ASRock, X670E Taichi,1776.49,AM5,EATX,192,4,Black
mobo,Gigabyte, B760 AORUS ELITE AX,736.57,LGA1700,ATX,192,4,Black
mobo,Gigabyte, B450M DS3H,541.37,AM4,Micro ATX,128,4,Black / Silver
mobo,Gigabyte, B550M AORUS ELITE,573.13,AM4,Micro ATX,128,4,Black / Orange
mobo,Gigabyte, X670E AORUS MASTER (rev. 1.0),1697.28,AM5,EATX,192,4,Black / Silver
mobo,ASRock, B650E Taichi Lite,1126.54,AM5,EATX,192,4,Black / Gray
mobo,ASRock, Z790 Riptide WiFi,866.56,LGA1700,ATX,192,4,Black
mobo,Asus, TUF GAMING B760-PLUS WIFI,779.9,LGA1700,ATX,192,4,Black
mobo,Gigabyte, Z790 GAMING X AX,866.56,LGA1700,ATX,192,4,Black
mobo,Gigabyte, B650M GAMING X AX,930.99,AM5,Micro ATX,192,4,Black
mobo,ASRock, B760M-HDV/M.2 D4,389.93,LGA1700,Micro ATX,64,2,Silver / Black
mobo,Asus, PRIME Z390-P,866.34,LGA1151,ATX,128,4,Silver / Black
mobo,MSI, MPG Z790 CARBON WIFI II,1733.16,LGA1700,ATX,192,4,Black
mobo,Gigabyte, A620M S2H,389.93,AM5,Micro ATX,96,2,Gray / Black
mobo,ASRock, B660M-HDV,411.59,LGA1700,Micro ATX,64,2,Gray / Black
mobo,MSI, MPG B760I EDGE WIFI,895.24,LGA1700,Mini ITX,96,2,Black / Silver
mobo,Asus, ROG STRIX Z690-A GAMING WIFI D4,1723.93,LGA1700,ATX,128,4,Silver / Black
mobo,Asus, PRIME B760M-A,630.62,LGA1700,Micro ATX,128,4,Silver / Black
mobo,MSI, MEG X670E ACE,2946.4,AM5,EATX,192,4,Black / Gold
mobo,ASRock, X670E Taichi Carrara,1863.15,AM5,EATX,192,4,Black / White
mobo,MSI, MEG Z790 ACE MAX,3033.06,LGA1700,EATX,192,4,Black
mobo,MSI, PRO Z690-A WIFI DDR4,823.23,LGA1700,ATX,128,4,Black / Silver
mobo,MSI, Z390-A PRO,1066.7,LGA1151,ATX,128,4,Brown / Black
mobo,Gigabyte, B650M DS3H,838.57,AM5,Micro ATX,192,4,Brown / Black
mobo,Gigabyte, B650M K,519.92,AM5,Micro ATX,192,4,Brown / Silver
mobo,ASRock, H310CM-DVS,272.11,LGA1151,Micro ATX,32,2,Black
mobo,Asus, PRIME B450M-K II,395.04,AM4,Micro ATX,64,2,Black
mobo,Asus, TUF GAMING Z790-PLUS WIFI D4,866.56,LGA1700,ATX,128,4,Black
mobo,Gigabyte, B550 AORUS ELITE V2,751.0,AM4,ATX,128,4,Black
mobo,Asus, ROG Crosshair VIII Dark Hero,2513.1,AM4,ATX,128,4,Black / Silver
mobo,Asus, PRIME Z390-A,1230.57,LGA1151,ATX,128,4,Silver / Black
mobo,ASRock, Z790 Pro RS,736.57,LGA1700,ATX,192,4,Silver / Black
mobo,MSI, PRO B760-VC WIFI IV,693.24,LGA1700,ATX,256,4,Black / Silver
mobo,MSI, PRO Z790-VC WIFI,693.24,LGA1700,ATX,192,4,Black
mobo,Asus, PRIME A520M-A II/CSM,346.6,AM4,Micro ATX,128,4,Silver / Black
mobo,MSI, MPG B650 CARBON WIFI,1986.55,AM5,ATX,192,4,Black
mobo,ASRock, B450M/AC,356.95,AM4,Micro ATX,64,4,Black
mobo,ASRock, A520M-ITX/ac,516.36,AM4,Mini ITX,64,2,Black / Silver
mobo,MSI, Z790 GAMING PRO WIFI,823.23,LGA1700,ATX,192,4,Black
mobo,Gigabyte, B650 UD AC,736.57,AM5,ATX,192,4,Black / Gray
mobo,Asus, PRIME B760M-A WIFI D4,816.94,LGA1700,Micro ATX,128,4,Silver / Black
mobo,Gigabyte, Z390 AORUS PRO WIFI,1291.23,LGA1151,ATX,128,4,Black / Silver
mobo,ASRock, B550 Pro4,518.53,AM4,ATX,128,4,Silver / Black
mobo,Gigabyte, H610I,519.92,LGA1700,Mini ITX,64,2,Black
mobo,MSI, MAG B660 TOMAHAWK WIFI DDR4,1020.38,LGA1700,ATX,128,4,Black / Silver
mobo,MSI, MPG Z790 EDGE WIFI,1264.98,LGA1700,ATX,192,4,Silver / Black
mobo,Asus, PRIME H610I-PLUS D4-CSM,489.59,LGA1700,Mini ITX,64,2,Silver / Black
mobo,ASRock, B760M Steel Legend WiFi,693.24,LGA1700,Micro ATX,192,4,Silver / Black
mobo,Asus, PRIME B660-PLUS D4,645.7,LGA1700,ATX,128,4,Silver / Black
mobo,MSI, MAG B550M MORTAR MAX WIFI,649.91,AM4,Micro ATX,128,4,Silver / Black
mobo,Asus, ROG STRIX X570-E GAMING WIFI II,1988.85,AM4,ATX,128,4,Black
mobo,Asus, TUF GAMING B550-PLUS,680.28,AM4,ATX,128,4,Black
mobo,ASRock, B650E PG-ITX WIFI,1256.53,AM5,Mini ITX,96,2,Black / Red
mobo,Asus, TUF GAMING B650-PLUS,1128.92,AM5,ATX,128,4,Black / Orange
mobo,Asus, PRIME X670-P,957.68,AM5,ATX,192,4,Silver / Black
mobo,MSI, PRO B550M-P GEN3,448.9,AM4,Micro ATX,128,4,Black
mobo,ASRock, B760M PG Riptide,563.25,LGA1700,Micro ATX,192,4,Black / Blue
mobo,Gigabyte, B760M AORUS ELITE AX,758.23,LGA1700,Micro ATX,192,4,Black / Silver
mobo,Asus, PRIME H510M-K,559.22,LGA1200,Micro ATX,64,2,Black / Silver
mobo,ASRock, Z690 PG Riptide,541.58,LGA1700,ATX,128,4,Black / Silver
mobo,MSI, Z490-A PRO,1425.56,LGA1200,ATX,128,4,Black / Silver
mobo,MSI, PRO B760M-A WIFI,736.57,LGA1700,Micro ATX,192,4,Black
mobo,Asus, PRIME H610M-K D4,465.32,LGA1700,Micro ATX,64,2,Silver / Black
mobo,Gigabyte, B450M DS3H V2,445.61,AM4,Micro ATX,128,4,Black
mobo,MSI, MEG Z690 ACE,970.55,LGA1700,EATX,192,4,Black / Gold
mobo,ASRock, B450 Steel Legend,433.26,AM4,ATX,64,4,Black / Silver
mobo,Supermicro, X10SLL-F,736.57,LGA1150,Micro ATX,32,4,Black / Green
mobo,ASRock, B560M-HDV,563.25,LGA1200,Micro ATX,64,2,Silver / Black
mobo,Asus, ROG STRIX Z590-E GAMING WIFI,1514.95,LGA1200,ATX,128,4,Black
mobo,MSI, MPG Z790 CARBON WIFI,1904.61,LGA1700,ATX,192,4,Black
mobo,Gigabyte, B760M C,606.58,LGA1700,Micro ATX,192,4,Brown / Gray
mobo,ASRock, A520M-HVS,351.97,AM4,Micro ATX,64,2,Black / Silver
mobo,Gigabyte, Z790 AORUS MASTER,1906.48,LGA1700,EATX,192,4,Black / Silver
mobo,Gigabyte, B450 AORUS ELITE V2,549.47,AM4,ATX,128,4,Black
mobo,Asus, ROG CROSSHAIR X670E GENE,2854.28,AM5,Micro ATX,96,2,Black / Silver
mobo,Gigabyte, Z790 AORUS XTREME X,6984.36,LGA1700,EATX,192,4,Black
mobo,ASRock, Z790 Taichi Lite,1481.84,LGA1700,EATX,192,4,Black / Gray
mobo,Asus, TUF GAMING B650M-E WIFI,985.89,AM5,Micro ATX,192,4,Black
mobo,Asus, TUF GAMING Z690-PLUS WIFI,953.22,LGA1700,ATX,192,4,Black / Gray
mobo,ASRock, Z690 Phantom Gaming 4/D5,563.25,LGA1700,ATX,192,4,Black / Silver
mobo,Asus, PRIME Z490-P,866.56,LGA1200,ATX,128,4,Black / Silver
mobo,ASRock, B650E STEEL LEGEND WIFI,866.56,AM5,ATX,192,4,Black / Silver
mobo,ASRock, B760 Pro RS/D4,647.78,LGA1700,ATX,128,4,Silver / Black
mobo,MSI, PRO B760M-P,613.25,LGA1700,Micro ATX,192,4,Black
mobo,MSI, MEG Z690 UNIFY,866.56,LGA1700,ATX,192,4,Black / Silver
mobo,Asus, PRIME A520M-K,423.98,AM4,Micro ATX,64,2,Black / Silver
mobo,MSI, PRO X670-P WIFI,1516.51,AM5,ATX,192,4,Black / White
mobo,Asus, ROG STRIX B760-F GAMING WIFI,1074.32,LGA1700,ATX,192,4,Black
mobo,Asus, PRIME Z790M-PLUS,853.56,LGA1700,Micro ATX,192,4,Silver / Black
mobo,ASRock, Z690M Phantom Gaming 4,433.26,LGA1700,Micro ATX,128,4,Silver / Black
mobo,ASRock, H610M-HDV/M.2+ D5,426.37,LGA1700,Micro ATX,96,2,White / Black
mobo,ASRock, B760M-ITX/D4 WiFi,645.57,LGA1700,Mini ITX,64,2,Silver / Black
mobo,MSI, MAG B560M MORTAR WIFI,1041.13,LGA1200,Micro ATX,128,4,Black / White
mobo,MSI, MPG X570 GAMING EDGE WIFI,1295.57,AM4,ATX,128,4,Black / Silver
mobo,Asus, TUF GAMING X670E-PLUS,1530.11,AM5,ATX,192,4,Black / Orange
mobo,Asus, TUF GAMING B660-PLUS WIFI D4,935.1,LGA1700,ATX,128,4,Yellow / Black
mobo,MSI, MAG Z790 TOMAHAWK WIFI DDR4,1151.49,LGA1700,ATX,128,4,Black
mobo,Asus, PRIME B550M-K,498.17,AM4,Micro ATX,128,4,Black / White
mobo,ASRock, X570 Phantom Gaming-ITX/TB3,1295.57,AM4,Mini ITX,64,2,Black / Silver
mobo,MSI, MPG Z690 EDGE WIFI DDR4,1598.88,LGA1700,ATX,128,4,Black / Gray
mobo,Asus, PROART B650-CREATOR,996.55,AM5,ATX,192,4,Black / Copper
mobo,Gigabyte, B450 I AORUS PRO WIFI,845.06,AM4,Mini ITX,64,2,Black / Silver
mobo,MSI, PRO Z790-A WIFI DDR4,844.89,LGA1700,ATX,128,4,Black / Silver
mobo,ASRock, B760 Pro RS,649.91,LGA1700,ATX,192,4,Silver / Black
mobo,ASRock, X670E Pro RS,953.22,AM5,ATX,192,4,Black
mobo,Gigabyte, B760I AORUS PRO DDR4,823.23,LGA1700,Mini ITX,64,2,Black / Gray
mobo,Asus, PRIME B450M-A,899.1,AM4,Micro ATX,64,4,Black
mobo,Gigabyte, A620M GAMING X,519.92,AM5,Micro ATX,192,4,Brown / Gray
mobo,Asus, PRIME B450-PLUS,567.45,AM4,ATX,64,4,Black / Silver
mobo,Gigabyte, B760M D3H,628.24,LGA1700,Micro ATX,192,4,Black / Gray
mobo,Gigabyte, Z790 AORUS MASTER X,2166.46,LGA1700,EATX,192,4,Black
mobo,ASRock, X570 Phantom Gaming 4S,17071.02,AM4,ATX,128,4,Black
mobo,ASRock, Z790M-ITX WIFI,996.55,LGA1700,Mini ITX,96,2,Black
mobo,Asus, TUF GAMING B450-PLUS II,587.47,AM4,ATX,128,4,Black
mobo,Gigabyte, A620M GAMING X AX,552.67,AM5,Micro ATX,192,4,Brown / Gray
mobo,ASRock, H670M-ITX/ax,719.23,LGA1700,Mini ITX,64,2,Silver / Black
mobo,Gigabyte, B760 DS3H AC DDR4,606.58,LGA1700,ATX,128,4,Black
mobo,Asus, ROG STRIX Z390-E GAMING,1581.54,LGA1151,ATX,128,4,Black
mobo,Asus, ROG STRIX B760-A GAMING WIFI D4,931.55,LGA1700,ATX,128,4,Silver / Black
mobo,Asus, PRIME Z790-P WIFI D4,953.22,LGA1700,ATX,128,4,Black / Silver
mobo,ASRock, Z690 Phantom Gaming-ITX/TB4,844.89,LGA1700,Mini ITX,96,2,Black / Red
mobo,Asus, ROG STRIX B550-F GAMING (WI-FI),1425.56,AM4,ATX,128,4,Black
mobo,Gigabyte, Z790 AORUS PRO X WIFI7,1516.51,LGA1700,ATX,192,4,Black
mobo,MSI, MPG B760M EDGE TI WIFI,996.55,LGA1700,Micro ATX,192,4,Silver / Black
mobo,Gigabyte, B450 AORUS PRO WIFI (rev. 1.0),1028.05,AM4,ATX,64,4,Black / Silver
mobo,Asus, TUF GAMING B760M-PLUS WIFI D4,1110.33,LGA1700,Micro ATX,128,4,Black / Orange
mobo,Asus, PRIME B650M-A AX II,693.24,AM5,Micro ATX,192,4,Black / Silver
mobo,ASRock, Z790 Steel Legend WiFi,996.55,LGA1700,ATX,192,4,Silver / Black
mobo,Gigabyte, Z790I AORUS ULTRA,1256.53,LGA1700,Mini ITX,96,2,Silver / Black
mobo,Gigabyte, GA-H270N-WIFI,909.89,LGA1151,Mini ITX,32,2,Black / Silver
mobo,ASRock, Z790 PRO RS WIFI,814.56,LGA1700,ATX,192,4,Silver / Black
mobo,Gigabyte, B650E AORUS MASTER,1941.27,AM5,ATX,192,4,Black / Silver
mobo,Gigabyte, H510M S2H V3,391.75,LGA1200,Micro ATX,64,2,Gray / Black
mobo,Asus, PRIME H510M-E,498.25,LGA1200,Micro ATX,64,2,Silver / Black
mobo,Gigabyte, Z790 D AC,801.56,LGA1700,ATX,192,4,Gray / Black
mobo,Gigabyte, X570 AORUS ELITE WIFI,1386.52,AM4,ATX,128,4,Black
mobo,MSI, MPG Z390 GAMING EDGE AC,1733.16,LGA1151,ATX,128,4,Black / Silver
mobo,MSI, B450-A PRO MAX,628.16,AM4,ATX,64,4,Brown / Black
mobo,Asus, PRIME X570-PRO,1987.59,AM4,ATX,128,4,Black / White
mobo,Gigabyte, B760M DS3H AX DDR4,713.13,LGA1700,Micro ATX,128,4,Black
mobo,Gigabyte, B450 AORUS M,666.85,AM4,Micro ATX,64,4,Black / Gray
mobo,Asus, PRIME H610M-A WIFI D4,659.22,LGA1700,Micro ATX,64,2,Black / Silver
mobo,MSI, MEG Z790 ACE,2036.47,LGA1700,EATX,192,4,Gold / Black
mobo,ASRock, Z790 PG Lightning/D4,996.68,LGA1700,ATX,128,4,Black
mobo,ASRock, A620M-HDV/M.2,476.59,AM5,Micro ATX,96,2,Gray / Black
mobo,MSI, X470 GAMING PLUS MAX,866.56,AM4,ATX,64,4,Black
mobo,ASRock, X570 Phantom Gaming 4 WiFi ax,563.25,AM4,ATX,128,4,Black
mobo,Asus, PRIME Z270-A,1653.0,LGA1151,ATX,64,4,Black / White
mobo,ASRock, B450 Pro4 R2.0,500.72,AM4,ATX,128,4,Black
mobo,Gigabyte, Z690 AORUS ELITE AX DDR4,1122.2,LGA1700,ATX,128,4,Black / Silver
mobo,Asus, ROG Strix X570-I Gaming,2335.49,AM4,Mini ITX,64,2,Black
mobo,Gigabyte, A520 AORUS ELITE,515.71,AM4,ATX,128,4,Black / Orange
mobo,ASRock, B650M PG RIPTIDE,803.03,AM5,Micro ATX,192,4,Black
mobo,Asus, ROG STRIX Z690-F GAMING WIFI,1412.56,LGA1700,ATX,192,4,Black / Silver
mobo,ASRock, Z790 PG LIGHTNING,909.89,LGA1700,ATX,192,4,Black
mobo,Asus, PRIME B660M-K D4,493.62,LGA1700,Micro ATX,64,2,Silver / Black
mobo,Gigabyte, B650 AORUS PRO AX,1589.56,AM5,ATX,192,4,Black
mobo,Asus, H110M-K,823.23,LGA1151,Micro ATX,32,2,Black / Gold
mobo,Gigabyte, B760 DS3H AC,671.57,LGA1700,ATX,192,4,Gray / Black
mobo,Asus, PRIME Z690-P WIFI,779.9,LGA1700,ATX,192,4,Silver / Black
mobo,Gigabyte, B450 AORUS ELITE,688.51,AM4,ATX,64,4,Black / Silver
mobo,Asus, ROG STRIX Z790-A GAMING WIFI,1461.3,LGA1700,ATX,192,4,Silver / Black
mobo,MSI, MEG Z790 GODLIKE,4989.15,LGA1700,EATX,192,4,Black
mobo,MSI, MPG Z790 CARBON MAX WIFI II,2036.47,LGA1700,ATX,256,4,Black
mobo,Asus, TUF GAMING B450M-PLUS II,617.15,AM4,Micro ATX,128,4,Black
mobo,Gigabyte, B650 AERO G,1126.54,AM5,ATX,192,4,Black / Silver
mobo,ASRock, B550M Phantom Gaming 4,454.92,AM4,Micro ATX,128,4,Black
mobo,Asus, ROG STRIX B660-A GAMING WIFI D4,953.22,LGA1700,ATX,128,4,Silver / Black
mobo,Gigabyte, B760M GAMING X AX DDR4,834.54,LGA1700,Micro ATX,128,4,Black
mobo,Asus, PRIME X570-P,1249.16,AM4,ATX,128,4,Black / White
mobo,MSI, MAG B550M MORTAR WIFI,1255.7,AM4,Micro ATX,128,4,Silver / Black
mobo,Gigabyte, Z790 AERO G,1126.54,LGA1700,ATX,192,4,
mobo,MSI, PRO B760-P DDR4 II,742.89,LGA1700,ATX,128,4,Black
mobo,ASRock, X570 Steel Legend,606.58,AM4,ATX,128,4,Black / Silver
mobo,Asus, TUF GAMING X570-PLUS,1255.96,AM4,ATX,128,4,Black / Gold
mobo,Gigabyte, B650M GAMING PLUS WF,693.24,AM5,Micro ATX,192,4,Silver / Black
mobo,MSI, B560M PRO-E,580.58,LGA1200,Micro ATX,64,2,Black
mobo,Asus, ROG Strix X570-E Gaming,2638.8,AM4,ATX,128,4,Black
mobo,Gigabyte, H410M S2H V2,373.24,LGA1200,Micro ATX,64,2,Black / Gray
mobo,Asus, TUF GAMING B660M-PLUS WIFI,1017.65,LGA1700,Micro ATX,192,4,Yellow / Black
mobo,Gigabyte, H610M K DDR4,424.55,LGA1700,Micro ATX,64,2,Black
mobo,ASRock, X570S PG Riptide,606.58,AM4,ATX,128,4,Black
